{
  "id": "f-b6f25ca560",
  "title": "TV 부가서비스 가입내역",
  "major": "이용·변경",
  "middle": "TV",
  "minor": "TV 부가서비스 가입내역",
  "menu": [
    "마이",
    "TV",
    "TV 부가서비스 가입내역"
  ],
  "url": "https://www.skylife.co.kr/my/tv/service",
  "route": "/my/tv/service",
  "summary": "TV 부가서비스 가입 내역과 제공되는 관리 기능을 확인합니다.",
  "aliases": [
    "TV 가입내역",
    "TV 계약",
    "TV 상품 확인",
    "TV 부가서비스 해지",
    "TV 부가서비스 변경"
  ],
  "steps": [
    "조회할 TV 가입상품 또는 회선을 선택합니다.",
    "이용 중인 부가서비스와 상세 내용을 확인합니다.",
    "화면에서 제공하는 상세 안내 또는 관리 기능을 확인합니다."
  ],
  "note": "서비스별로 신청·변경·해지 가능 여부가 다릅니다. 실제 제공되는 버튼과 안내를 확인하세요.",
  "login": true,
  "product": "TV",
  "action": "조회",
  "external": false,
  "sourceVerified": true,
  "screen": {
    "src": "screens/f-b6f25ca560-authenticated.jpg",
    "kind": "authenticated",
    "caption": "테스트 계정으로 확인한 실제 기능 화면 · 고객 식별정보와 개인 조회내역을 가려 캡처했습니다.",
    "captured": "2026-10-14",
    "url": "https://www.skylife.co.kr/my/tv/service"
  },
  "script": "고객님, 스카이라이프 홈페이지에서 로그인하신 뒤 마이 → TV → TV 부가서비스 가입내역 메뉴로 이동해주세요. 조회할 TV 가입상품 또는 회선을 선택합니다. 이용 중인 부가서비스와 상세 내용을 확인합니다. 화면에서 제공하는 상세 안내 또는 관리 기능을 확인합니다.",
  "priority": 100,
  "availability": {
    "mode": "lookup",
    "label": "조회",
    "reviewedAt": "2026-10-14"
  },
  "$schema": "../feature.schema.json"
}
