{
  "id": "f-fe8e96aa42",
  "title": "TV 요금제 안내",
  "major": "가입·상품",
  "middle": "TV",
  "minor": "TV 요금제 안내",
  "menu": [
    "상품",
    "TV",
    "요금제"
  ],
  "url": "https://www.skylife.co.kr/product/tv/all",
  "route": "/product/tv/all",
  "summary": "TV 상품의 요금과 제공 채널·서비스를 비교합니다.",
  "aliases": [
    "티비 요금제",
    "TV 가격",
    "IPTV",
    "위성TV",
    "베이직",
    "플러스",
    "초이스"
  ],
  "steps": [
    "TV 요금제 화면을 엽니다.",
    "관심 상품을 선택합니다.",
    "요금·채널 구성·약정 등 상세 안내를 확인합니다."
  ],
  "note": "위성TV와 IPTV의 상품 구성·제공 기능을 구분하세요.",
  "login": false,
  "product": "TV",
  "action": "안내",
  "external": false,
  "sourceVerified": true,
  "screen": {
    "src": "screens/f-fe8e96aa42.jpg",
    "kind": "live",
    "caption": "실제 홈페이지 화면 캡처",
    "captured": "2026-10-14",
    "url": "https://www.skylife.co.kr/product/tv/all"
  },
  "script": "고객님, 스카이라이프 홈페이지에서 상품 → TV → 요금제 메뉴로 이동해주세요. TV 요금제 화면을 엽니다. 관심 상품을 선택합니다. 요금·채널 구성·약정 등 상세 안내를 확인합니다.",
  "priority": 100,
  "availability": {
    "mode": "guide",
    "label": "정보 안내",
    "reviewedAt": "2026-10-14"
  },
  "$schema": "../feature.schema.json"
}
