{
  "id": "f-ed8c3722d3",
  "title": "TV 가입 정보",
  "major": "이용·변경",
  "middle": "TV",
  "minor": "TV 가입 정보",
  "menu": [
    "마이",
    "TV",
    "TV 가입 정보"
  ],
  "url": "https://www.skylife.co.kr/my/tv/info",
  "route": "/my/tv/info",
  "summary": "TV 가입상품의 상세 정보를 확인합니다.",
  "aliases": [
    "TV 약정",
    "TV 가입일",
    "TV 상품명",
    "TV 가입 확인"
  ],
  "steps": [
    "조회할 TV 가입상품 또는 회선을 선택합니다.",
    "가입상품의 상세 정보와 표시된 이용 조건을 확인합니다.",
    "화면에서 제공하는 상세 안내 또는 관리 기능을 확인합니다."
  ],
  "note": "서비스별로 신청·변경·해지 가능 여부가 다릅니다. 실제 제공되는 버튼과 안내를 확인하세요.",
  "login": true,
  "product": "TV",
  "action": "조회",
  "external": false,
  "sourceVerified": true,
  "screen": {
    "src": "screens/f-ed8c3722d3-authenticated.jpg",
    "kind": "authenticated",
    "caption": "테스트 계정으로 확인한 실제 기능 화면 · 고객 식별정보와 개인 조회내역을 가려 캡처했습니다.",
    "captured": "2026-10-14",
    "url": "https://www.skylife.co.kr/my/tv/info"
  },
  "script": "고객님, 스카이라이프 홈페이지에서 로그인하신 뒤 마이 → TV → TV 가입 정보 메뉴로 이동해주세요. 조회할 TV 가입상품 또는 회선을 선택합니다. 가입상품의 상세 정보와 표시된 이용 조건을 확인합니다. 화면에서 제공하는 상세 안내 또는 관리 기능을 확인합니다.",
  "priority": 100,
  "availability": {
    "mode": "lookup",
    "label": "조회",
    "reviewedAt": "2026-10-14"
  },
  "$schema": "../feature.schema.json"
}
