{
  "id": "f-e2a1f4f6fe",
  "title": "사회공헌",
  "major": "문의·고객지원",
  "middle": "공지사항",
  "minor": "사회공헌",
  "menu": [
    "고객지원",
    "공지사항",
    "사회공헌"
  ],
  "url": "https://www.skylife.co.kr/center/notice/list?code=c7384c93-118f-3082-9db3-2b555554043d",
  "route": "/center/notice/list?code=c7384c93-118f-3082-9db3-2b555554043d",
  "summary": "사회공헌 화면에서 관련 정보와 이용 안내를 확인합니다.",
  "aliases": [
    "사회공헌"
  ],
  "steps": [
    "사회공헌 화면을 엽니다.",
    "고객 문의에 해당하는 항목이나 분류를 선택합니다.",
    "상세 내용과 안내된 이용 조건·다음 경로를 확인합니다."
  ],
  "note": "현재 화면의 상세 안내를 기준으로 설명하세요.",
  "login": false,
  "product": "공통",
  "action": "안내",
  "external": false,
  "sourceVerified": true,
  "screen": {
    "src": "screens/f-e2a1f4f6fe.jpg",
    "kind": "live",
    "caption": "실제 홈페이지 화면 캡처",
    "captured": "2026-10-14",
    "url": "https://www.skylife.co.kr/center/notice/list?code=c7384c93-118f-3082-9db3-2b555554043d"
  },
  "script": "고객님, 스카이라이프 홈페이지에서 고객지원 → 공지사항 → 사회공헌 메뉴로 이동해주세요. 사회공헌 화면을 엽니다. 고객 문의에 해당하는 항목이나 분류를 선택합니다. 상세 내용과 안내된 이용 조건·다음 경로를 확인합니다.",
  "priority": 100,
  "availability": {
    "mode": "guide",
    "label": "정보 안내",
    "reviewedAt": "2026-10-14"
  },
  "$schema": "../feature.schema.json"
}
