{
  "id": "f-448c018e21",
  "title": "모바일 일시정지/해제",
  "major": "이용·변경",
  "middle": "모바일",
  "minor": "모바일 일시정지/해제",
  "menu": [
    "마이",
    "모바일",
    "모바일 일시정지/해제"
  ],
  "url": "https://www.skylife.co.kr/my/mobile/pause",
  "route": "/my/mobile/pause",
  "summary": "모바일 회선의 일시정지를 신청하거나 정지된 회선의 해제를 진행합니다.",
  "aliases": [
    "휴대폰 정지",
    "잠깐 정지",
    "분실",
    "잃어버림",
    "정지 풀기",
    "일시정지 해제",
    "다시 사용"
  ],
  "steps": [
    "정지 또는 해제할 모바일 회선을 선택합니다.",
    "일시정지 신청 또는 해제하기를 선택합니다.",
    "본인확인·정지 비밀번호 등 화면에서 요구하는 절차를 완료합니다."
  ],
  "note": "정지 유형에 따른 이용조건과 비용 안내를 확인하세요. 미납정지 해제는 요금 메뉴에서 확인합니다.",
  "login": true,
  "product": "모바일",
  "action": "변경",
  "external": false,
  "sourceVerified": true,
  "screen": {
    "src": "screens/f-448c018e21-authenticated.jpg",
    "kind": "authenticated",
    "caption": "테스트 계정으로 확인한 실제 기능 화면 · 고객 식별정보와 개인 조회내역을 가려 캡처했습니다.",
    "captured": "2026-10-14",
    "url": "https://www.skylife.co.kr/my/mobile/pause"
  },
  "script": "고객님, 스카이라이프 홈페이지에서 로그인하신 뒤 마이 → 모바일 → 모바일 일시정지/해제 메뉴로 이동해주세요. 정지 또는 해제할 모바일 회선을 선택합니다. 일시정지 신청 또는 해제하기를 선택합니다. 본인확인·정지 비밀번호 등 화면에서 요구하는 절차를 완료합니다.",
  "priority": 100,
  "availability": {
    "mode": "action",
    "label": "신청·변경",
    "reviewedAt": "2026-10-14"
  },
  "$schema": "../feature.schema.json"
}
