{
  "id": "f-5dff7e4c9c",
  "title": "S-머니 사용하기",
  "major": "혜택·콘텐츠",
  "middle": "S-머니",
  "minor": "S-머니 사용하기",
  "menu": [
    "S-머니",
    "S-머니 사용하기"
  ],
  "url": "https://skylifemoney.co.kr/article/%EA%B3%B5%EC%A7%80%EC%82%AC%ED%95%AD/1/64",
  "route": "https://skylifemoney.co.kr/article/%EA%B3%B5%EC%A7%80%EC%82%AC%ED%95%AD/1/64",
  "summary": "S-머니 사용하기 화면에서 관련 정보와 이용 안내를 확인합니다.",
  "aliases": [
    "S-머니사용하기"
  ],
  "steps": [
    "S-머니 사용하기 화면을 엽니다.",
    "고객 문의에 해당하는 항목이나 분류를 선택합니다.",
    "상세 내용과 안내된 이용 조건·다음 경로를 확인합니다."
  ],
  "note": "현재 화면의 상세 안내를 기준으로 설명하세요.",
  "login": false,
  "product": "공통",
  "action": "안내",
  "external": true,
  "sourceVerified": false,
  "screen": {
    "src": "screens/f-5dff7e4c9c.jpg",
    "kind": "live",
    "caption": "실제 홈페이지 화면 캡처",
    "captured": "2026-10-14",
    "url": "https://skylifemoney.co.kr/article/%EA%B3%B5%EC%A7%80%EC%82%AC%ED%95%AD/1/64"
  },
  "script": "고객님, 스카이라이프 홈페이지에서 S-머니 → S-머니 사용하기 메뉴로 이동해주세요. S-머니 사용하기 화면을 엽니다. 고객 문의에 해당하는 항목이나 분류를 선택합니다. 상세 내용과 안내된 이용 조건·다음 경로를 확인합니다.",
  "priority": 100,
  "availability": {
    "mode": "external",
    "label": "외부 서비스",
    "reviewedAt": "2026-10-14"
  },
  "$schema": "../feature.schema.json"
}
