{
  "id": "f-f2cd9d9f66",
  "title": "종료된 이벤트",
  "major": "혜택·콘텐츠",
  "middle": "이벤트",
  "minor": "종료된 이벤트",
  "menu": [
    "혜택·콘텐츠",
    "이벤트",
    "종료된 이벤트"
  ],
  "url": "https://www.skylife.co.kr/event?state=end",
  "route": "/event?state=end",
  "summary": "종료된 이벤트 화면에서 관련 정보와 이용 안내를 확인합니다.",
  "aliases": [
    "종료된이벤트"
  ],
  "steps": [
    "종료된 이벤트 화면을 엽니다.",
    "고객 문의에 해당하는 항목이나 분류를 선택합니다.",
    "상세 내용과 안내된 이용 조건·다음 경로를 확인합니다."
  ],
  "note": "현재 화면의 상세 안내를 기준으로 설명하세요.",
  "login": false,
  "product": "공통",
  "action": "안내",
  "external": false,
  "sourceVerified": true,
  "screen": {
    "src": "screens/f-f2cd9d9f66.jpg",
    "kind": "live",
    "caption": "실제 홈페이지 화면 캡처",
    "captured": "2026-10-14",
    "url": "https://www.skylife.co.kr/event?state=end"
  },
  "script": "고객님, 스카이라이프 홈페이지에서 혜택·콘텐츠 → 이벤트 → 종료된 이벤트 메뉴로 이동해주세요. 종료된 이벤트 화면을 엽니다. 고객 문의에 해당하는 항목이나 분류를 선택합니다. 상세 내용과 안내된 이용 조건·다음 경로를 확인합니다.",
  "priority": 100,
  "availability": {
    "mode": "guide",
    "label": "정보 안내",
    "reviewedAt": "2026-10-14"
  },
  "$schema": "../feature.schema.json"
}
