{
  "id": "f-31afa34831",
  "title": "요금 납부 이력 조회",
  "major": "요금·납부",
  "middle": "요금 조회",
  "minor": "요금 납부 이력 조회",
  "menu": [
    "마이",
    "요금",
    "요금 납부 이력 조회"
  ],
  "url": "https://www.skylife.co.kr/my/charge/pay/inquiry",
  "route": "/my/charge/pay/inquiry",
  "summary": "납부기간별 금액·납부일·납부상태를 확인하고 납부내역서를 신청합니다.",
  "aliases": [
    "입금 확인",
    "돈 냈어",
    "납부확인서",
    "납부영수증",
    "결제내역",
    "납부내역서",
    "이메일 발송"
  ],
  "steps": [
    "조회할 상품 또는 청구계정과 조회 기간을 선택합니다.",
    "납부금액·납부일·납부상태를 확인합니다.",
    "증빙이 필요하면 납부내역서 신청에서 수신 이메일을 확인합니다."
  ],
  "note": "결제 직후 반영 시점은 달라질 수 있습니다. 납부내역서 발송 완료 메시지를 확인하세요.",
  "login": true,
  "product": "공통",
  "action": "조회",
  "external": false,
  "sourceVerified": true,
  "screen": {
    "src": "screens/f-31afa34831-authenticated.jpg",
    "kind": "authenticated",
    "caption": "테스트 계정으로 확인한 실제 기능 화면 · 고객 식별정보와 개인 조회내역을 가려 캡처했습니다.",
    "captured": "2026-10-14",
    "url": "https://www.skylife.co.kr/my/charge/pay/inquiry"
  },
  "script": "고객님, 스카이라이프 홈페이지에서 로그인하신 뒤 마이 → 요금 → 요금 납부 이력 조회 메뉴로 이동해주세요. 조회할 상품 또는 청구계정과 조회 기간을 선택합니다. 납부금액·납부일·납부상태를 확인합니다. 증빙이 필요하면 납부내역서 신청에서 수신 이메일을 확인합니다.",
  "priority": 100,
  "availability": {
    "mode": "lookup",
    "label": "조회",
    "reviewedAt": "2026-10-14"
  },
  "$schema": "../feature.schema.json"
}
