{
  "id": "f-1d95194ec6",
  "title": "홍보센터",
  "major": "문의·고객지원",
  "middle": "회사·브랜드",
  "minor": "홍보센터",
  "menu": [
    "브랜드",
    "홍보센터"
  ],
  "url": "https://corp.skylife.co.kr/media/news",
  "route": "https://corp.skylife.co.kr/media/news",
  "summary": "홍보센터 화면에서 관련 정보와 이용 안내를 확인합니다.",
  "aliases": [
    "홍보센터"
  ],
  "steps": [
    "홍보센터 화면을 엽니다.",
    "고객 문의에 해당하는 항목이나 분류를 선택합니다.",
    "상세 내용과 안내된 이용 조건·다음 경로를 확인합니다."
  ],
  "note": "현재 화면의 상세 안내를 기준으로 설명하세요.",
  "login": false,
  "product": "공통",
  "action": "안내",
  "external": true,
  "sourceVerified": false,
  "screen": {
    "src": "screens/f-1d95194ec6.jpg",
    "kind": "live",
    "caption": "실제 홈페이지 화면 캡처",
    "captured": "2026-10-14",
    "url": "https://corp.skylife.co.kr/media/news"
  },
  "script": "고객님, 스카이라이프 홈페이지에서 브랜드 → 홍보센터 메뉴로 이동해주세요. 홍보센터 화면을 엽니다. 고객 문의에 해당하는 항목이나 분류를 선택합니다. 상세 내용과 안내된 이용 조건·다음 경로를 확인합니다.",
  "priority": 100,
  "availability": {
    "mode": "external",
    "label": "외부 서비스",
    "reviewedAt": "2026-10-14"
  },
  "$schema": "../feature.schema.json"
}
