{
  "id": "f-1c215786e9",
  "title": "개인정보",
  "major": "문의·고객지원",
  "middle": "공지사항",
  "minor": "개인정보",
  "menu": [
    "고객지원",
    "공지사항",
    "개인정보"
  ],
  "url": "https://www.skylife.co.kr/center/notice/list?code=7944dcb6-ae34-323c-a55b-3cf22c156363",
  "route": "/center/notice/list?code=7944dcb6-ae34-323c-a55b-3cf22c156363",
  "summary": "개인정보 화면에서 관련 정보와 이용 안내를 확인합니다.",
  "aliases": [
    "개인정보"
  ],
  "steps": [
    "개인정보 화면을 엽니다.",
    "고객 문의에 해당하는 항목이나 분류를 선택합니다.",
    "상세 내용과 안내된 이용 조건·다음 경로를 확인합니다."
  ],
  "note": "현재 화면의 상세 안내를 기준으로 설명하세요.",
  "login": false,
  "product": "공통",
  "action": "조회",
  "external": false,
  "sourceVerified": true,
  "screen": {
    "src": "screens/f-1c215786e9.jpg",
    "kind": "live",
    "caption": "실제 홈페이지 화면 캡처",
    "captured": "2026-10-14",
    "url": "https://www.skylife.co.kr/center/notice/list?code=7944dcb6-ae34-323c-a55b-3cf22c156363"
  },
  "script": "고객님, 스카이라이프 홈페이지에서 고객지원 → 공지사항 → 개인정보 메뉴로 이동해주세요. 개인정보 화면을 엽니다. 고객 문의에 해당하는 항목이나 분류를 선택합니다. 상세 내용과 안내된 이용 조건·다음 경로를 확인합니다.",
  "priority": 100,
  "availability": {
    "mode": "guide",
    "label": "정보 안내",
    "reviewedAt": "2026-10-14"
  },
  "$schema": "../feature.schema.json"
}
